title,release_date,tmdb_vote_count,tmdb_vote_average,genre_names,budget,revenue,runtime_in_min,tmdb_popularity,production_company_name,production_country_name,spoken_languages,director,writer,actors,imdb_rating,imdb_votes,metascore,age_rating,awards,rotten_tomatoes_rating,meta_critic_rating
The Room,2019-09-12,949,6.4,"Horror, Drama, Mystery, Science Fiction",0,44291,100,14.616,"Versus Production, Les Films du Poisson, Bidibul Productions","Belgium, France, Luxembourg",English,Christian Volckman,"Christian Volckman, Eric Forestier, Gaia Guasti","Olga Kurylenko, Kevin Janssens, Joshua Wilson",6.0,"24,907",,Not Rated,2 wins & 5 nominations total,69.0,
Hustlers,2019-09-12,2951,6.475,"Drama, Comedy, Crime",20000000,157563598,110,26.764,"STXfilms, Gloria Sanchez Productions, Nuyorican Productions",United States of America,"English, Spanish, Russian",Lorene Scafaria,"Lorene Scafaria, Jessica Pressler","Constance Wu, Jennifer Lopez, Julia Stiles",6.3,"109,521",79.0,R,25 wins & 83 nominations total,88.0,79.0
Freaks,2019-09-12,1156,6.8,Science Fiction,2000,368410,105,16.895,"Amazing Incorporated, My Way Entertainment, Bloomgarden Films","Canada, United States of America",English,"Zach Lipovsky, Adam B. Stein","Zach Lipovsky, Adam B. Stein","Emile Hirsch, Bruce Dern, Grace Park",6.7,"42,582",63.0,R,9 wins & 15 nominations total,88.0,63.0
Downton Abbey,2019-09-12,1146,7.142,"Drama, Romance, History",20000000,194694725,122,25.721,"Focus Features, Carnival Films, Perfect World Pictures","United Kingdom, United States of America",English,Michael Engler,Julian Fellowes,"Stephen Campbell Moore, Michael Fox, Lesley Nicol",7.4,"65,552",64.0,PG,3 wins & 19 nominations total,84.0,64.0
The Report,2019-09-12,1038,7.031,Drama,8000000,275000,119,13.697,"Margin of Error, Vice Studios, Topic Studios, Unbranded Pictures",United States of America,"Arabic, English",Scott Z. Burns,Scott Z. Burns,"Adam Driver, Annette Bening, Jon Hamm",7.2,"52,846",66.0,R,4 wins & 13 nominations,82.0,66.0
The Goldfinch,2019-09-12,883,7.151,Drama,40000000,0,149,22.68,"Color Force, Amazon Studios, Warner Bros. Pictures",United States of America,English,John Crowley,"Peter Straughan, Donna Tartt","Oakes Fegley, Ansel Elgort, Nicole Kidman",6.4,"27,849",40.0,R,3 nominations,24.0,40.0
"Someone, Somewhere",2019-09-11,660,6.4,"Drama, Romance, Comedy",0,0,110,15.2,"Ce qui me meut, StudioCanal, France 2 Cinéma, Panache Productions, Proximus, Move Movie, La Compagnie Cinématographique","Belgium, France",French,Cédric Klapisch,"Santiago Amigorena, Cédric Klapisch","François Civil, Ana Girardot, Camille Cottin",6.6,"5,481",,PG,2 nominations,100.0,
I See You,2019-09-11,1476,7.0,"Horror, Thriller, Mystery",3000000,0,98,22.017,Zodiac Features,United States of America,English,Adam Randall,Devon Graye,"Helen Hunt, Jon Tenney, Owen Teague",6.8,"69,726",65.0,R,1 win & 1 nomination total,73.0,65.0
Corpus Christi,2019-09-10,546,7.64,Drama,1300000,9943901,116,13.348,"Aurum Film, Canal+ Polska, WFS Walter Film Studio, Les Contes Modernes","France, Poland",Polish,Jan Komasa,Mateusz Pacewicz,"Bartosz Bielenia, Aleksandra Konieczna, Eliza Rycembel",7.7,"22,669",77.0,Unrated,Nominated for 1 Oscar. 55 wins & 41 nominations total,98.0,77.0
Bad Education,2019-09-08,682,6.749,"Drama, Crime, History",0,0,108,11.908,"Sight Unseen Pictures, Automatik Entertainment, Slater Hall Pictures",United States of America,English,Cory Finley,"Mike Makowsky, Robert Kolker","Hugh Jackman, Ray Romano, Welker White",7.1,"44,430",79.0,TV-MA,Won 1 Primetime Emmy. 9 wins & 28 nominations total,94.0,79.0
Color Out of Space,2019-09-07,1496,6.042,"Horror, Science Fiction, Mystery, Thriller",6000000,1023510,110,22.208,"SpectreVision, BRO Cinema, ACE Pictures Entertainment, XYZ Films","Malaysia, Portugal, United States of America",English,Richard Stanley,"H.P. Lovecraft, Richard Stanley, Scarlett Amaris","Nicolas Cage, Joely Richardson, Madeleine Arthur",6.2,"59,965",70.0,Unrated,11 wins & 17 nominations total,86.0,70.0
A Beautiful Day in the Neighborhood,2019-09-07,1630,6.965,"Drama, History",25000000,67900000,109,24.673,"TriStar Pictures, Tencent Pictures, Big Beach","China, United States of America",English,Marielle Heller,"Micah Fitzerman-Blue, Noah Harpster, Tom Junod","Matthew Rhys, Tom Hanks, Chris Cooper",7.2,"90,936",80.0,PG,Nominated for 1 Oscar. 10 wins & 64 nominations total,,80.0
Vivarium,2019-09-07,2167,6.063,"Science Fiction, Thriller, Mystery, Horror",4000000,488000,97,30.631,"Fantastic Films, Frakas Productions, XYZ Films, PingPongFilm, VOO, BeTV, Fís Éireann/Screen Ireland","Belgium, Denmark, Ireland, United States of America",English,Lorcan Finnegan,"Garret Shanley, Lorcan Finnegan","Imogen Poots, Danielle Ryan, Molly McCann",5.9,"78,372",64.0,R,3 wins & 10 nominations,73.0,64.0
"Live Twice, Love Once",2019-09-06,340,7.472,"Comedy, Drama",1450000,368430,101,11.964,"Alamar Cinema 161, Convoy Films, Film Factory",Spain,Spanish,Maria Ripoll,María Mínguez,"Oscar Martínez, Inma Cuesta, Mafalda Carbonell",7.2,"7,426",,TV-MA,6 wins & 9 nominations total,67.0,
Violet Evergarden: Eternity and the Auto Memory Doll,2019-09-06,378,8.2,"Drama, Fantasy, Animation",0,10841702,91,16.621,"Kyoto Animation, Pony Canyon, ABC Animation, Bandai Namco Arts",Japan,Japanese,Haruka Fujita,"Kana Akatsuki, Reiko Yoshida, Takaaki Suzuki","Yui Ishikawa, Minako Kotobuki, Aoi Yûki",7.5,"7,166",,TV-PG,1 nomination total,,
Waiting for the Barbarians,2019-09-06,380,5.9,"Drama, History",0,761361,114,9.246,"AMBI Group, Infinitum Nihil, Ithaca Pictures, Iervolino Entertainment, Samuel Goldwyn Films","Italy, United States of America","English, Mongolian",Ciro Guerra,J.M. Coetzee,"Mark Rylance, Johnny Depp, Robert Pattinson",5.9,"15,353",52.0,,1 win & 3 nominations total,54.0,52.0
Our Friend,2019-09-04,302,7.2,"Drama, Romance",0,0,124,12.818,"Black Bear Pictures, BBP Friend, Scott Free Productions",United States of America,English,Gabriela Cowperthwaite,"Brad Ingelsby, Matthew Teague","Jason Segel, Isabella Kai, Violet McGraw",7.3,"16,090",57.0,R,,85.0,57.0
Martin Eden,2019-09-04,664,7.0,"Romance, Drama",3800000,1681545,129,11.941,"Avventurosa, IBC MOvie, The Match Factory, Shellac Sud, ARTE, BR, RAI Cinema","France, Germany, Italy","French, Italian",Pietro Marcello,"Jack London, Maurizio Braucci, Pietro Marcello","Luca Marinelli, Jessica Cressy, Vincenzo Nemolato",7.0,"7,991",75.0,TV-PG,12 wins & 54 nominations,88.0,75.0
Play,2019-09-04,349,7.278,Comedy,0,0,108,6.275,"Chapter 2, Moonshaker",France,French,Anthony Marciano,"Max Boublil, Anthony Marciano","Max Boublil, Alice Isaaz, Malik Zidi",7.2,"1,755",,,1 nomination,,
It Chapter Two,2019-09-04,8835,6.84,"Horror, Thriller",79000000,473123154,169,88.502,"New Line Cinema, Vertigo Entertainment, Double Dream, Rideback",United States of America,English,Andy Muschietti,"Stephen King, Gary Dauberman","Jessica Chastain, James McAvoy, Bill Hader",6.5,"318,911",58.0,R,7 wins & 34 nominations total,62.0,58.0
Scooby-Doo! Return to Zombie Island,2019-09-03,927,6.981,"Fantasy, Animation, Family, Adventure, Comedy, Mystery, Horror",0,0,80,23.684,Warner Bros. Animation,United States of America,English,"Cecilia Aranovich, Ethan Spaulding",Jeremy Adams,"Frank Welker, Grey Griffin, Matthew Lillard, Kate Micucci",5.7,"1,501",,Not Rated,,,
Eye for an Eye,2019-08-30,309,6.67,"Drama, Thriller, Crime",3328289,2407571,107,13.01,"Atresmedia, Vaca Films, Quien a hierro mata, Sony Pictures International Productions, Film Constellation, Ministerio de Educación, Cultura y Deporte, Xunta de Galicia, Canal+, MEDIA Programme of the European Union, Playtime","Belgium, France, Spain, United Kingdom, United States of America","Galician, Spanish",Paco Plaza,"Juan Galiñanes, Jorge Guerricaechevarría","Luis Tosar, Xan Cejudo, Ismael Martínez",6.6,"8,964",,TV-MA,8 wins & 20 nominations,88.0,
Tod@s Caen,2019-08-30,476,7.8,Comedy,0,0,120,15.386,Videocine,Mexico,Spanish,Ariel Winograd,"Cory Brusseau, Martha Higareda","Martha Higareda, Omar Chaparro, Dunia Alexandra",5.0,673,,PG-13,,57.0,
Invisible Life,2019-08-30,310,7.9,Drama,0,0,140,9.862,"RT Features, Pola Pandora Filmproduktions, Canal Brasil, Sony Pictures Entertainment Brazil, Naymar","Brazil, Germany","Greek, Portuguese",Karim Aïnouz,"Murilo Hauser, Inés Bortagaray, Karim Aïnouz","Julia Stockler, Carol Duarte, Flávia Gusmão",7.7,"10,133",81.0,R,38 wins & 52 nominations total,94.0,81.0
Don't Let Go,2019-08-30,389,6.8,"Science Fiction, Thriller, Mystery, Horror",5000000,5300000,107,18.722,Blumhouse Productions,United States of America,English,Jacob Estes,"Jacob Estes, Drew Daywalt","David Oyelowo, Storm Reid, Mykelti Williamson",6.4,"13,812",49.0,R,,42.0,49.0
KONOSUBA – God's blessing on this wonderful world! Legend of Crimson,2019-08-30,554,8.1,"Animation, Adventure, Comedy, Fantasy",0,0,90,24.208,"J.C.STAFF, KADOKAWA, Sammy, Nippon Columbia, Sony Music Entertainment, MAGES., KADOKAWA Media House, 81 Produce, Toranoana",Japan,Japanese,Takaomi Kanasaki,"Natsume Akatsuki, Kurone Mishima, Makoto Uezu","Jun Fukushima, Sora Amamiya, Rie Takahashi",7.8,"5,797",,Not Rated,1 win & 1 nomination,,
The Fanatic,2019-08-30,313,4.4,"Crime, Thriller",18000000,3153,89,13.281,"Daniel Grodnik Productions, Fig Production Group, Media Finance Capital, Pretzel Fang Productions, Wonderfilm Media, Oscar Generale Productions, Taurus Film","United Kingdom, United States of America","Spanish, English",Fred Durst,"Fred Durst, Dave Bekerman","John Travolta, Devon Sawa, Ana Golja",4.1,"12,851",18.0,R,2 wins & 2 nominations total,15.0,18.0
Uncut Gems,2019-08-30,4820,7.154,"Drama, Thriller, Crime",19000000,50023780,136,32.332,"A24, Elara Pictures, IAC Films, Sikelia Productions, Scott Rudin Productions",United States of America,English,"Benny Safdie, Josh Safdie","Ronald Bronstein, Josh Safdie, Benny Safdie","Adam Sandler, Julia Fox, Idina Menzel",7.4,"329,718",93.0,R,28 wins & 96 nominations total,91.0,93.0
The Informer,2019-08-30,856,6.5,"Drama, Crime, Thriller",60000000,2927708,109,20.644,"Thunder Road, The Fyzz, Maddem Films","United Kingdom, United States of America","English, Polish, Spanish",Andrea Di Stefano,"Matt Cook, Rowan Joffe, Andrea Di Stefano","Joel Kinnaman, Rosamund Pike, Common",6.6,"43,827",61.0,R,1 nomination total,63.0,61.0
Official Secrets,2019-08-30,994,7.218,"Thriller, History, Drama",0,0,112,22.447,"Clear Pictures Entertainment, Classified Films, Screen Yorkshire, Entertainment One, Sierra/Affinity, Entertainment One Features, The Mark Gordon Company","Canada, United Kingdom, United States of America","Mandarin, English",Gavin Hood,"Sara Bernstein, Gregory Bernstein, Gavin Hood","Keira Knightley, Matt Smith, Matthew Goode",7.3,"57,203",63.0,R,5 wins & 16 nominations total,82.0,63.0
Falling Inn Love,2019-08-29,1151,6.532,"Romance, Comedy",0,0,98,20.688,MarVista Entertainment,United States of America,English,Roger Kumble,"Elizabeth Hackett, Hilary Galanoy","Christina Milian, Adam Demos, Jeffrey Bowyer-Chapman",5.7,"22,985",,TV-PG,,71.0,
Running with the Devil,2019-08-29,313,5.4,"Crime, Drama, Thriller",0,0,100,13.434,"Patriot Pictures, Jaguar Bite, Saturn Films","Colombia, United States of America","English, Spanish",Jason Cabell,Jason Cabell,"Nicolas Cage, Laurence Fishburne, Leslie Bibb",5.4,"10,866",42.0,R,,25.0,42.0
Gundala,2019-08-29,320,6.22,"Action, Adventure, Science Fiction, Drama",1863258,4223384,123,5.604,"Screenplay Films, Legacy Pictures, Bumilangit Studios, Ideosource Entertainment, Screenplay Bumilangit",Indonesia,Indonesian,Joko Anwar,"Joko Anwar, Harya Suraminata","Abimana Aryasatya, Tara Basro, Bront Palarae",6.1,"5,969",,TV-14,7 wins & 19 nominations total,75.0,
Little Monsters,2019-08-29,685,6.53,"Horror, Comedy",0,0,94,14.588,"Screen Australia, Create NSW, Protagonist Pictures, Made Up Stories, Snoot Entertainment","Australia, United Kingdom, United States of America",English,Abe Forsythe,Abe Forsythe,"Lupita Nyong'o, Alexander England, Josh Gad",6.3,"20,178",59.0,R,3 wins & 10 nominations total,79.0,59.0
Paradise Hills,2019-08-29,536,6.0,"Fantasy, Science Fiction, Thriller",6000000,0,95,13.839,"Nostromo Pictures, Colina Paraiso AIE, TVE, Crea SGR, Generalitat de Catalunya - Departament de Cultura, Instituto de Ciencias y Artes Cinematográficas del Ministerio de Cultura, Nublar Productions","Spain, United States of America",English,Alice Waddington,"Sofía Cuenca, Brian DeLeeuw, Nacho Vigalondo","Emma Roberts, Danielle Macdonald, Awkwafina",5.2,"18,153",49.0,TV-14,1 win & 22 nominations total,68.0,49.0
Bacurau,2019-08-29,1058,7.679,"Mystery, Western, Thriller",1430000,3554178,131,10.966,"Símio Filmes, CinemaScópio, ARTE France Cinéma, Globo Filmes, SBS Productions, Canal Brasil, Telecine","Brazil, France","English, Portuguese","Juliano Dornelles, Kleber Mendonça Filho","Kleber Mendonça Filho, Juliano Dornelles","Bárbara Colen, Thomás Aquino, Silvero Pereira",7.3,"31,507",82.0,Not Rated,53 wins & 77 nominations,93.0,82.0
Night Hunter,2019-08-29,925,6.63,"Drama, Thriller",0,1012932,95,50.078,"Arcola Entertainment, Arise Pictures, Buffalo Gal Pictures, Fortitude International, PalmStar Media","Canada, United Kingdom, United States of America",English,David Raymond,David Raymond,"Henry Cavill, Ben Kingsley, Alexandra Daddario",5.9,"28,346",31.0,R,1 win & 1 nomination,14.0,31.0
School Life,2019-08-28,782,6.886,"Drama, Comedy",0,0,111,11.381,"Mandarin Production, Kallouche Cinéma, Gaumont, France 3 Cinéma",France,"Arabic, French","Mehdi Idir, Grand Corps Malade","Mehdi Idir, Grand Corps Malade","Zita Hanrot, Liam Pierron, Soufiane Guerrab",6.5,"3,418",,TV-MA,1 win & 3 nominations,100.0,
An Easy Girl,2019-08-28,351,5.6,"Comedy, Drama",0,0,92,14.623,"Les Films Velvet, France 3 Cinéma",France,"English, French, Italian",Rebecca Zlotowski,"Teddy Lussi-Modeste, Rebecca Zlotowski","Mina Farid, Zahia Dehar, Benoît Magimel",5.6,"6,445",79.0,TV-MA,3 nominations total,95.0,79.0
The Legend of Hei,2019-08-27,378,8.4,"Animation, Fantasy, Action",0,48045728,102,15.185,"MTJJ, Beijing Guangying Gongchang Wenhua Chuanbo, Dream Castle, Heyi Capital, Beijing Hanmu Chunhua Animation Technology, Beijing Jiyin Yinghua",China,Mandarin,Mtjj,"Mtjj, Kexin Peng, Fengxishenlei","Xin Shan, Yuntu Cao, Khoi Dao",7.3,"2,523",,,3 wins & 9 nominations total,,
A Hidden Life,2019-08-27,691,7.1,"History, Drama, War",9000000,4645140,173,12.962,"Studio Babelsberg, Elizabeth Bay Productions, Aceway Productions","Germany, United States of America","English, German",Terrence Malick,Terrence Malick,"August Diehl, Valerie Pachner, Maria Simon",7.4,"29,539",80.0,PG-13,8 wins & 27 nominations total,82.0,80.0
Dave Chappelle: Sticks & Stones,2019-08-26,320,7.6,Comedy,0,0,65,8.768,,United States of America,English,Stan Lathan,Dave Chappelle,Dave Chappelle,8.3,"28,457",,TV-MA,Won 3 Primetime Emmys. 4 wins & 5 nominations total,42.0,
Brittany Runs a Marathon,2019-08-23,482,6.6,"Comedy, Drama",0,7439448,103,9.046,"Material Pictures, Picture Films",United States of America,English,Paul Downs Colaizzo,Paul Downs Colaizzo,"Jillian Bell, Jennifer Dundas, Patch Darragh",6.8,"22,699",72.0,R,2 wins & 7 nominations,89.0,72.0
Ready or Not,2019-08-21,4674,7.042,"Horror, Comedy",6000000,57600000,95,67.082,"Mythology Entertainment, Vinson Films, Fox Searchlight Pictures, Radio Silence Productions",United States of America,English,"Matt Bettinelli-Olpin, Tyler Gillett","Guy Busick, R. Christopher Murphy","Samara Weaving, Adam Brody, Mark O'Brien",6.9,"205,803",64.0,R,4 wins & 24 nominations total,89.0,64.0
American Factory,2019-08-21,455,7.163,Documentary,0,0,110,10.268,"Higher Ground, Participant, Field of Vision",United States of America,"Mandarin, English","Steven Bognar, Julia Reichert",,"Junming 'Jimmy' Wang, Robert Allen, Sherrod Brown",7.4,"24,214",86.0,TV-14,Won 1 Oscar. 19 wins & 50 nominations total,95.0,86.0
Angel Has Fallen,2019-08-21,3543,6.6,"Action, Thriller",40000000,146661977,122,57.703,"Campbell Grobman Films, Eclectic Pictures, G-BASE, Millennium Media",United States of America,English,Ric Roman Waugh,"Robert Mark Kamen, Matt Cook, Ric Roman Waugh","Gerard Butler, Frederick Schmidt, Danny Huston",6.4,"115,166",45.0,R,1 nomination total,38.0,45.0
Sextuplets,2019-08-16,845,6.221,Comedy,0,0,100,24.381,Wayans Alvarez Productions,United States of America,English,Michael Tiddes,"Mike Glock, Rick Alvarez, Marlon Wayans","Marlon Wayans, Bresha Webb, Michael Ian Black",4.5,"9,790",21.0,TV-14,,21.0,21.0
Iron Mask,2019-08-16,481,6.1,"Action, Adventure, Family, Fantasy",49000000,8685794,121,27.503,"CTB Film Company, Russian Film Group, China Film Group Corporation, Buffalo 8 Productions, China International Picture, Fetisoff Illusion, GFA Entertainment, Gap Financing, Lime Studios, Sparkle Roll Media","China, Russia","Mandarin, English, Russian",Oleg Stepchenko,"Oleg Stepchenko, Dmitry Paltsev, Alexey A. Petrukhin","Jason Flemyng, Xingtong Yao, Jackie Chan",4.7,"9,207",34.0,PG-13,2 nominations total,19.0,34.0
"Where'd You Go, Bernadette",2019-08-16,656,6.601,"Comedy, Drama",20000000,0,109,15.512,"Annapurna Pictures, Color Force",United States of America,English,Richard Linklater,"Richard Linklater, Holly Gent, Vincent Palmo Jr.","Cate Blanchett, Billy Crudup, Emma Nelson",6.5,"26,357",51.0,PG-13,4 nominations total,50.0,51.0
Heroic Losers,2019-08-15,561,7.6,"Comedy, Thriller",0,7364054,116,11.509,"K & S Films, Kenya Films, Mod Producciones, TVE, Telefe, INCAA, Cine Argentino","Argentina, Spain",Spanish,Sebastián Borensztein,"Sebastián Borensztein, Eduardo Sacheri","Ricardo Darín, Luis Brandoni, Verónica Llinás",7.2,"13,227",,TV-MA,4 wins & 14 nominations,93.0,
47 Meters Down: Uncaged,2019-08-15,1420,5.7,Horror,12000000,47582563,90,31.139,"The Fyzz, Entertainment Studios","United Kingdom, United States of America",English,Johannes Roberts,"Johannes Roberts, Ernest Riera","Sophie Nélisse, Corinne Foxx, Brianne Tju",5.0,"31,951",43.0,PG-13,,45.0,43.0
Monos,2019-08-15,394,6.6,"Drama, Adventure",1800000,1929915,103,9.863,"Stela Cine, Caracol Televisión, Bord Cadre Films, Dynamo, Campo Cine, Film i Väst, Lemming Film, Mutante Cine, Pando Producciones, Pandora Filmproduktion, Snowglobe","Argentina, Colombia, Denmark, Germany, Netherlands, Sweden, Switzerland, Uruguay","English, Spanish",Alejandro Landes,"Alejandro Landes, Alexis Dos Santos","Sofia Buenaventura, Julián Giraldo, Karen Quintero",6.8,"19,264",78.0,R,39 wins & 70 nominations,93.0,78.0
Hair Love,2019-08-14,466,7.589,"Animation, Family, Comedy",284058,0,7,6.325,"Sony Pictures Animation, Matthew A. Cherry Entertainment, Lion Forge Animation",United States of America,English,"Matthew A. Cherry, Everett Downing Jr., Bruce W. Smith",Matthew A. Cherry,Issa Rae,7.4,"7,253",,G,Won 1 Oscar. 4 wins & 1 nomination total,,
Good Boys,2019-08-14,1859,6.9,Comedy,20000000,111037232,89,18.771,"Good Universe, Point Grey Pictures",United States of America,English,Gene Stupnitsky,"Lee Eisenberg, Gene Stupnitsky","Jacob Tremblay, Keith L. Williams, Brady Noon",6.7,"84,782",60.0,R,2 wins & 7 nominations total,37.0,60.0
Otherhood,2019-08-13,451,6.2,Comedy,0,0,100,12.719,,"United States of America, United Kingdom",English,Cindy Chupack,"Mark Andrus, Cindy Chupack, William Sutcliffe","Angela Bassett, Patricia Arquette, Felicity Huffman",6.1,"12,882",38.0,R,1 win total,30.0,38.0
Blinded by the Light,2019-08-09,578,6.934,"Drama, Comedy",8300000,18144644,118,16.728,"Bend It Films, Ingenious Media, Levantine Films, Rakija Films, Cornerstone Films, New Line Cinema, Endeavor Content","United Kingdom, United States of America",English,Gurinder Chadha,"Sarfraz Manzoor, Gurinder Chadha, Paul Mayeda Berges","Billy Barratt, Ronak Singh Chadha Berges, Viveik Kalra",6.9,"27,787",71.0,PG-13,2 wins & 8 nominations total,89.0,71.0
The Peanut Butter Falcon,2019-08-09,1426,7.4,"Adventure, Comedy, Drama",0,0,97,26.742,"Armory Films, Endeavor Content, Bona Fide Productions, Lucky Treehouse",United States of America,English,"Tyler Nilson, Michael Schwartz","Tyler Nilson, Michael Schwartz","Zack Gottsagen, Ann Pierce, Dakota Johnson",7.6,"111,804",70.0,PG-13,20 wins & 16 nominations total,95.0,70.0
Light of My Life,2019-08-09,534,6.4,"Science Fiction, Drama",0,0,119,14.219,"Black Bear Pictures, Sea Change Media",United States of America,English,Casey Affleck,Casey Affleck,"Anna Pniowsky, Casey Affleck, Tom Bower",6.6,"15,992",67.0,R,5 nominations,80.0,67.0
The Art of Racing in the Rain,2019-08-08,1506,8.2,"Drama, Romance",18000000,33800000,109,32.342,"Original Film, Shifting Gears Productions, Fox 2000 Pictures, Starbucks Entertainment",United States of America,"Spanish, English, Italian",Simon Curtis,"Mark Bomback, Garth Stein","Kevin Costner, Milo Ventimiglia, Jackie Minns",7.6,"40,608",43.0,PG,,44.0,43.0
Danger Close: The Battle of Long Tan,2019-08-08,325,6.803,"War, Action, Drama, History",23934823,2078370,119,12.77,"Red Dune Films, Full Clip Productions, Deeper Water Films, Sunjive Studios, THN Nominees, Hoosegow Productions, Ingenious Media","Australia, United Kingdom","English, Vietnamese",Kriv Stenders,"Stuart Beattie, James Nicholas, Karel Segers","Travis Fimmel, Toby Blome, Alexander England",6.8,"15,656",,R,8 wins & 6 nominations total,71.0,
Dora and the Lost City of Gold,2019-08-08,1725,6.634,"Adventure, Comedy, Family, Fantasy",49000000,120600000,102,46.918,"Nickelodeon Movies, Paramount Players, Walden Media, Screen Queensland, Paramount Pictures, MRC","Australia, United States of America","Spanish, English",James Bobin,"Nicholas Stoller, Matthew Robinson, Tom Wheeler","Isabela Merced, Eugenio Derbez, Michael Peña",6.1,"36,522",63.0,PG,4 wins & 2 nominations total,85.0,63.0
The Kitchen,2019-08-08,690,6.1,"Action, Crime, Drama",38000000,16000000,103,17.379,"New Line Cinema, Michael De Luca Productions, DC Vertigo, Bron Studios, Warner Bros. Pictures","United States of America, Canada",English,Andrea Berloff,"Andrea Berloff, Ollie Masters, Ming Doyle","Melissa McCarthy, Tiffany Haddish, Elisabeth Moss",5.6,"23,349",35.0,R,1 nomination,24.0,35.0
Scary Stories to Tell in the Dark,2019-08-08,2669,6.5,"Horror, Adventure, Mystery",25000000,104545505,108,25.715,"1212 Entertainment, Double Dare You, Entertainment One, CBS Films, Rolling Hills, Hivemind, Starlight Culture Entertainment Group","Canada, Hong Kong, United States of America",English,André Øvredal,"Dan Hageman, Kevin Hageman, Guillermo del Toro","Zoe Colletti, Michael Garza, Gabriel Rush",6.2,"88,442",61.0,PG-13,5 wins & 6 nominations total,78.0,61.0
Bring the Soul: The Movie,2019-08-07,438,8.402,"Music, Documentary",0,12150259,105,8.288,"Big Hit Entertainment, The Walt Disney Company Korea",South Korea,Korean,Jun-Soo Park,,"RM, Jin, j-hope",8.4,"2,943",,Not Rated,,,
Father There Is Only One,2019-08-02,734,7.666,Comedy,3400000,15894372,95,17.79,"Bowfinger, Mama se fue de viaje la pelicula, Sony Pictures International Productions",Spain,Spanish,Santiago Segura,"Marta González de Vega, Santiago Segura, Juan Vera","Santiago Segura, Toni Acosta, Sílvia Abril",6.0,"3,435",,Not Rated,1 win,,
Descendants 3,2019-08-02,1530,7.692,"Family, TV Movie, Adventure, Fantasy",15000000,0,106,44.938,"Bad Angels Productions, Ltd., 5678 Productions, Disney Channels Worldwide",United States of America,English,Kenny Ortega,"Josann McGibbon, Sara Parriott","Dove Cameron, Cameron Boyce, Sofia Carson",6.4,"12,639",,TV-G,1 win & 1 nomination total,78.0,
The Angry Birds Movie 2,2019-08-02,1727,7.1,"Animation, Action, Fantasy, Adventure, Comedy",65000000,137792047,97,39.229,"Rovio Animation, Columbia Pictures, Sony Pictures Animation, Rovio Entertainment","Finland, United States of America",English,"Thurop Van Orman, John Rice","Peter Ackerman, Eyal Podell, Jonathon E. Stewart","Jason Sudeikis, Josh Gad, Leslie Jones",6.4,"37,382",60.0,PG,1 win & 3 nominations total,72.0,60.0
A Score to Settle,2019-08-01,493,5.9,"Action, Crime, Drama, Thriller",0,0,103,22.95,"Paragon Media Productions, Goldrush Entertainment, Minds Eye Entertainment, Spartiate Films, Ingenious Media, Saturn Films","Canada, United Kingdom, United States of America",English,Shawn Ku,"Shawn Ku, John Newman","Nicolas Cage, Noah Le Gros, Karolina Wydra",4.8,"7,312",37.0,Not Rated,1 nomination total,16.0,37.0
Fast & Furious Presents: Hobbs & Shaw,2019-08-01,7284,6.851,"Action, Adventure, Comedy",200000000,760098996,137,112.405,"Chris Morgan Productions, Seven Bucks Productions, Universal Pictures",United States of America,"English, Russian, Samoan",David Leitch,"Chris Morgan, Drew Pearce, Gary Scott Thompson","Dwayne Johnson, Jason Statham, Idris Elba",6.5,"245,121",60.0,PG-13,1 win & 25 nominations total,67.0,60.0
The Red Sea Diving Resort,2019-07-28,817,6.835,"Drama, Thriller, History",0,0,130,16.395,"Bron Studios, EMJAG Productions, G. Raff Productions, Creative Wealth Media Finance","Canada, United States of America","Italian, English, Arabic",Gideon Raff,Gideon Raff,"Mbulelo Grootboom, Sizo Mahlangu, Michael Kenneth Williams",6.6,"33,220",,TV-MA,,28.0,
Ne Zha,2019-07-26,441,7.9,"Animation, Fantasy, Adventure",20000000,742718496,110,187.52,"Beijing Enlight Pictures, Horgos Coloroom Pictures, October Media, Chengdu Coco Cartoon",China,Mandarin,Yu Yang,"Yu Yang, Yunyun Wei, Zhonglin Xu","Yanting Lü, Joseph, Mo Han",7.4,"8,872",54.0,Not Rated,21 wins & 24 nominations total,88.0,54.0
Skin,2019-07-26,409,7.0,"Drama, Crime, History, Romance",0,0,110,17.929,"Maven Screen Media, Sight Unseen Pictures, Allusionist Picture House, Brookstreet Pictures, Come What May Productions, Hua Wen Movie Group, Item 7, Lost Lane Entertainment, New Native Pictures, PaperChase Films, Tugawood Pictures, Bretz Filmes, Voltage Pictures","Brazil, Canada, China, United States of America",English,Guy Nattiv,Guy Nattiv,"Jamie Bell, Danielle Macdonald, Daniel Henshall",6.8,"19,539",58.0,R,1 win & 3 nominations,76.0,58.0
