title,release_date,tmdb_vote_count,tmdb_vote_average,genre_names,budget,revenue,runtime_in_min,tmdb_popularity,production_company_name,production_country_name,spoken_languages,director,writer,actors,imdb_rating,imdb_votes,metascore,age_rating,awards,rotten_tomatoes_rating,meta_critic_rating
Bones and All,2022-11-18,1387,7.1,"Drama, Horror, Romance",16000000,15234907,130,36.034,"Frenesy Film, Per Capita Productions, MeMo Films, The Apartment Pictures, 3 Marys Entertainment, Tenderstories, Elafilm","Italy, United States of America",English,Luca Guadagnino,"David Kajganich, Camille DeAngelis","Timothée Chalamet, Taylor Russell, Mark Rylance",6.8,"63,370",74.0,R,4 wins & 79 nominations,82.0,74.0
Viking Wolf,2022-11-18,324,5.7,"Horror, Thriller, Mystery",0,0,97,18.909,"Filmkameratene, REinvent Studios","Denmark, Norway","Norwegian, Swedish",Stig Svendsen,"Espen Aukan, Stig Svendsen","Sjur Vatne Brean, Liv Mjönes, Arthur Hakalahti",5.2,"8,111",,TV-MA,1 nomination total,,
Slumberland,2022-11-18,847,7.3,"Family, Fantasy, Comedy",35000000,0,117,18.688,"Chernin Entertainment, about:blank",United States of America,English,Francis Lawrence,"David Guion, Michael Handelman","Jason Momoa, Marlow Barkley, Chris O'Dowd",6.7,"34,113",40.0,PG,3 nominations total,40.0,40.0
Disenchanted,2022-11-18,1096,6.716,"Comedy, Family, Fantasy",0,0,119,29.689,"Walt Disney Pictures, Josephson Entertainment, Right Coast",United States of America,English,Adam Shankman,"Brigitte Hales, J. David Stem, David N. Weiss","Amy Adams, Patrick Dempsey, Maya Rudolph",5.6,"27,827",50.0,PG,1 win & 1 nomination total,,50.0
She Said,2022-11-17,609,7.234,"Drama, History",32000000,13900000,129,12.719,"Plan B Entertainment, Annapurna Pictures, Universal Pictures",United States of America,"Spanish, English, Portuguese",Maria Schrader,"Rebecca Lenkiewicz, Jodi Kantor, Megan Twohey","Zoe Kazan, Carey Mulligan, Patricia Clarkson",7.3,"43,977",74.0,R,Nominated for 2 BAFTA 14 wins & 43 nominations total,88.0,74.0
Diabolik - Ginko Attacks,2022-11-17,465,5.989,"Crime, Action",0,1228459,111,11.63,"Mompracem, Astorina S.A.C., Emilia-Romagna Film Commission, RAI Cinema",Italy,Italian,"Antonio Manetti, Marco Manetti","Angela Giussani, Luciana Giussani, Antonio Manetti","Giacomo Gianniotti, Miriam Leone, Valerio Mastandrea",5.4,"1,330",,,6 nominations total,,
The Menu,2022-11-17,5117,7.178,"Comedy, Horror, Thriller",35000000,79628200,107,63.661,"Hyperobject Industries, Searchlight Pictures, Gary Sanchez Productions, TSG Entertainment",United States of America,"English, Spanish",Mark Mylod,"Seth Reiss, Will Tracy","Ralph Fiennes, Anya Taylor-Joy, Nicholas Hoult",7.2,"436,247",71.0,R,2 wins & 61 nominations total,88.0,71.0
Lamborghini: The Man Behind the Legend,2022-11-17,608,6.4,"Drama, History",1709686,0,97,29.921,"Iervolino & Lady Bacardi Entertainment, Grindstone Entertainment Group, Lambofilm, Zian Films","Italy, United States of America",English,Bobby Moresco,"Bobby Moresco, Tonino Lamborghini","Frank Grillo, Mira Sorvino, Gabriel Byrne",5.5,"14,557",,R,3 wins & 1 nomination total,6.0,
Poker Face,2022-11-16,321,5.512,"Thriller, Crime",0,0,94,18.635,"Screen Media Films, Arclight Films, CatchLight Studios, Alcon Entertainment, Hamilton Entertainment",United States of America,English,Russell Crowe,"Stephen M. Coates, Russell Crowe","Russell Crowe, Liam Hemsworth, RZA",5.2,"14,369",43.0,Not Rated,,9.0,43.0
R.I.P.D. 2: Rise of the Damned,2022-11-15,599,6.3,"Fantasy, Action, Comedy",0,0,102,33.274,"Universal 1440 Entertainment, Dark Horse Entertainment",United States of America,English,Paul Leyden,"Andrew Klein, Paul Leyden, Peter M. Lenkov","Jeffrey Donovan, Rachel Adedeji, Penelope Mitchell",4.6,"5,947",,PG-13,,,
Suzume,2022-11-11,1394,7.9,"Animation, Drama, Adventure, Fantasy",0,323638107,121,45.378,"CoMix Wave Films, Story, Lawson Entertainment, jeki, voque ting, KADOKAWA, Aniplex, TOHO",Japan,"English, Japanese",Makoto Shinkai,Makoto Shinkai,"Nanoka Hara, Hokuto Matsumura, Eri Fukatsu",7.6,"50,293",77.0,PG,3 wins & 30 nominations total,,77.0
The Fabelmans,2022-11-11,2397,7.605,Drama,40000000,45629909,151,26.714,"Amblin Entertainment, Reliance Entertainment",United States of America,"English, Portuguese",Steven Spielberg,"Steven Spielberg, Tony Kushner","Michelle Williams, Gabriel LaBelle, Paul Dano",7.5,"123,979",85.0,PG-13,Nominated for 7 Oscars. 31 wins & 297 nominations total,92.0,85.0
Lost Bullet 2,2022-11-10,373,6.539,"Action, Crime, Thriller",0,0,98,16.914,"Nolita, Versus Production, Inoxy Films","Belgium, France",French,Guillaume Pierret,"Guillaume Pierret, Alban Lenoir","Alban Lenoir, Stéfi Celma, Sébastien Lalanne",6.3,"5,355",,TV-MA,1 nomination,,
Falling for Christmas,2022-11-10,811,6.232,"Romance, Comedy, Family",0,0,95,11.331,"WulfPak Productions, Motion Picture Corporation of America, Brad Krevoy Television, Riviera Films",United States of America,English,Janeen Damian,"Jeff Bonnett, Ron Oliver","Lindsay Lohan, Chord Overstreet, George Young",5.3,"31,839",40.0,TV-PG,1 win total,62.0,40.0
The Son,2022-11-10,473,6.732,Drama,0,3564844,123,21.508,"Ingenious Media, Film4 Productions, See-Saw Films, Embankment Films, Cross City Films, Inthevoid Production","Australia, France, United Kingdom",English,Florian Zeller,"Florian Zeller, Christopher Hampton","Vanessa Kirby, Hugh Jackman, Laura Dern",6.5,"18,108",45.0,PG-13,1 win & 11 nominations total,28.0,45.0
Spirited,2022-11-10,646,6.885,Comedy,75000000,0,127,16.625,"Maximum Effort, Gloria Sanchez Productions, Two Grown Men, Apple Studios",United States of America,English,Sean Anders,"Sean Anders, John Morris, Charles Dickens","Will Ferrell, Ryan Reynolds, Octavia Spencer",6.6,"54,974",55.0,PG-13,8 nominations total,70.0,55.0
Guillermo del Toro's Pinocchio,2022-11-09,2984,8.07,"Animation, Fantasy, Drama",35000000,0,117,35.488,"The Jim Henson Company, ShadowMachine, Double Dare You",United States of America,English,"Guillermo del Toro, Mark Gustafson","Guillermo del Toro, Patrick McHale, Carlo Collodi","Ewan McGregor, David Bradley, Gregory Mann",7.6,"118,088",79.0,PG,Won 1 Oscar. 79 wins & 134 nominations total,27.0,79.0
Black Panther: Wakanda Forever,2022-11-09,6670,7.1,"Action, Adventure, Science Fiction",250000000,859102154,162,115.174,Marvel Studios,United States of America,"English, French, Haitian; Haitian Creole, Spanish, Xhosa",Ryan Coogler,"Ryan Coogler, Joe Robert Cole, Stan Lee","Letitia Wright, Lupita Nyong'o, Danai Gurira",6.7,"322,271",67.0,PG-13,Won 1 Oscar. 50 wins & 175 nominations total,84.0,67.0
Selena Gomez: My Mind & Me,2022-11-04,449,8.8,"Documentary, Music",0,0,95,30.757,"Lighthouse Management + Media, Interscope Films",United States of America,English,Alek Keshishian,"Alek Keshishian, Paul Marchand","Raquelle Stevens, Liana Blackburn, Brent L. Boxberger",7.4,"6,427",68.0,R,Nominated for 1 Primetime Emmy. 3 wins & 9 nominations total,97.0,68.0
Living,2022-11-04,424,7.0,Drama,10000000,6999027,102,13.817,"Number 9 Films, Film4 Productions, County Hall Arts, Lipsync Productions, RocketScience, Kurosawa Production, Filmgate Films, Film i Väst, Woolley/Karlsen Productions","Japan, Sweden, United Kingdom","English, Portuguese, Spanish",Oliver Hermanus,"Kazuo Ishiguro, Akira Kurosawa, Shinobu Hashimoto","Bill Nighy, Aimee Lou Wood, Alex Sharp",7.2,"36,141",81.0,PG-13,Nominated for 2 Oscars. 10 wins & 49 nominations total,96.0,81.0
The Wonder,2022-11-02,835,6.6,"Drama, Mystery",0,0,108,12.859,"Element Pictures, House Productions","Ireland, United Kingdom",English,Sebastián Lelio,"Emma Donoghue, Sebastián Lelio, Alice Birch","Florence Pugh, Tom Burke, Kíla Lord Cassidy",6.6,"46,167",71.0,R,Nominated for 1 BAFTA Award6 wins & 33 nominations total,85.0,71.0
Close,2022-11-01,815,7.801,Drama,0,3129968,104,37.645,"Menuet, Diaphana Films, Topkapi Films, Versus Production, VTM, RTBF","Belgium, France, Netherlands","French, Dutch",Lukas Dhont,"Lukas Dhont, Angelo Tijssens","Eden Dambrine, Gustav De Waele, Émilie Dequenne",7.8,"40,916",81.0,PG-13,Nominated for 1 Oscar. 58 wins & 85 nominations total,91.0,81.0
Masquerade,2022-11-01,427,6.8,"Comedy, Crime, Drama, Romance",14000000,6667598,142,10.604,"Les Films du Kiosque, Orange Studio, Pathé, TF1 Films Production, Canal+, Ciné+",France,"English, Spanish, French, Italian",Nicolas Bedos,Nicolas Bedos,"Pierre Niney, Isabelle Adjani, François Cluzet",6.4,"3,646",,,1 nomination,83.0,
On the Line,2022-10-31,504,6.1,"Thriller, Drama",0,0,104,15.427,"CaliWood Pictures, R-Lines Productions","France, United States of America",English,Romuald Boulanger,Romuald Boulanger,"Mel Gibson, William Moseley, Alia Seror-O'Neill",5.4,"15,944",,R,,21.0,
Armageddon Time,2022-10-28,429,6.5,Drama,15000000,6524886,114,13.687,"RT Features, Spacemaker Productions, Keep Your Head Productions, MadRiver Pictures, Focus Features","Brazil, United States of America",English,James Gray,James Gray,"Anne Hathaway, Jeremy Strong, Banks Repeta",6.5,"16,647",74.0,R,3 wins & 19 nominations total,76.0,74.0
Causeway,2022-10-28,460,6.5,Drama,0,0,96,12.311,"Excellent Cadaver, IAC Films, A24, IPR.VC","Finland, United States of America",English,Lila Neugebauer,"Ottessa Moshfegh, Luke Goebel, Elizabeth Sanders","Jennifer Lawrence, Brian Tyree Henry, Linda Emond",6.6,"24,473",66.0,R,Nominated for 1 Oscar. 4 wins & 40 nominations total,85.0,66.0
Beyond the Universe,2022-10-27,324,8.0,"Romance, Drama",0,0,126,14.382,Camisa Listrada,Brazil,Portuguese,Diego Freitas,"Diego Freitas, Ana Reber, Rod Azevedo","Henrique Zaga, Ashleigh Morghan, João Miguel",6.6,"2,535",,TV-MA,,,
Strangeness,2022-10-27,321,6.882,"Comedy, History, Drama",0,0,103,5.53,"BiBi Film, Indie Prod, Tramp LTD, Medusa Film, RAI Cinema",Italy,Italian,Roberto Andò,"Roberto Andò, Ugo Chiti, Massimo Gaudioso","Toni Servillo, Salvatore Ficarra, Valentino Picone",6.7,"1,757",,,9 wins & 12 nominations,,
Hellhole,2022-10-26,318,6.1,"Horror, Mystery",0,0,90,16.918,Akson Studio,Poland,"Latin, Polish",Bartosz M. Kowalski,"Bartosz M. Kowalski, Mirella Zaradkiewicz","Piotr Zurawski, Olaf Lubaszenko, Sebastian Stankiewicz",5.8,"8,549",,TV-MA,,67.0,
Prey for the Devil,2022-10-23,929,6.9,"Horror, Thriller",0,37655699,93,35.434,"Lionsgate, Gold Circle Films, Confluence Productions",United States of America,English,Daniel Stamm,"Robert Zappia, Earl Richey Jones, Todd R. Jones","Jacqueline Byers, Debora Zhecheva, Christian Navarro",5.3,"19,243",38.0,PG-13,,15.0,38.0
Aftersun,2022-10-21,1483,7.7,Drama,0,7834405,101,45.727,"PASTEL, BBC Film, Tango Entertainment, Unified Theory, Screen Scotland, BFI","United Kingdom, United States of America","English, Spanish, Turkish",Charlotte Wells,Charlotte Wells,"Paul Mescal, Frankie Corio, Celia Rowlson-Hall",7.6,"109,580",95.0,R,Nominated for 1 Oscar. 96 wins & 186 nominations total,95.0,95.0
Wendell & Wild,2022-10-21,323,6.7,"Animation, Comedy, Fantasy, Horror, Family",0,0,105,19.547,"The Gotham Group, Monkeypaw Productions",United States of America,English,Henry Selick,"Henry Selick, Jordan Peele, Clay McLeod Chapman","Lyric Ross, Keegan-Michael Key, Jordan Peele",6.4,"13,782",69.0,PG-13,3 wins & 26 nominations total,80.0,69.0
The Weekend Away,2022-03-03,706,6.0,"Thriller, Mystery",0,0,90,13.689,42,United Kingdom,English,Kim Farrant,Sarah Alderson,"Leighton Meester, Christina Wolfe, Ziad Bakri",5.7,"31,494",51.0,TV-14,1 win,41.0,51.0
Jerry & Marge Go Large,2022-10-20,361,7.4,"Comedy, Drama",0,0,96,26.572,"Landline Pictures, Levantine Films, Paramount Players, Netter Productions, MRC, Paramount Pictures",United States of America,"English, Turkish, Spanish",David Frankel,"Jason Fagone, Brad Copeland","Bryan Cranston, Annette Bening, Rainn Wilson",6.9,"29,118",52.0,PG-13,1 nomination total,67.0,52.0
My Policeman,2022-10-20,697,7.652,"Drama, Romance",0,0,113,9.848,"Amazon Studios, Berlanti Productions, Independent","United Kingdom, United States of America",English,Michael Grandage,"Ron Nyswaner, Bethan Roberts","Harry Styles, Emma Corrin, Gina McKee",6.5,"23,579",50.0,R,1 win & 4 nominations,44.0,50.0
The Banshees of Inisherin,2022-10-20,2845,7.454,"Drama, Comedy",20000000,49300000,114,25.901,"Searchlight Pictures, Blueprint Pictures, Film4 Productions, TSG Entertainment","United Kingdom, United States of America",English,Martin McDonagh,Martin McDonagh,"Colin Farrell, Brendan Gleeson, Kerry Condon",7.7,"271,880",87.0,R,Nominated for 9 Oscars. 148 wins & 375 nominations total,96.0,87.0
The School for Good and Evil,2022-10-19,1265,7.0,"Fantasy, Comedy, Adventure, Drama",0,0,149,48.959,"Feigco Entertainment, Jane Startz Productions, Roth Films",United States of America,"German, English, French",Paul Feig,"David Magee, Paul Feig, Soman Chainani","Kit Young, Sophia Anne Caruso, Cate Blanchett",5.9,"38,918",30.0,PG-13,1 win total,38.0,30.0
The Good Nurse,2022-10-19,1259,6.886,"Drama, Crime, Mystery",0,0,121,19.039,"Protozoa Pictures, FilmNation Entertainment",United States of America,English,Tobias Lindholm,"Charles Graeber, Krysty Wilson-Cairns","Eddie Redmayne, Denise Pillott, Dartel McRae",6.8,"83,303",65.0,R,Nominated for 1 BAFTA Award3 wins & 8 nominations total,74.0,65.0
Black Adam,2022-10-19,6426,6.9,"Action, Adventure, Science Fiction",200000000,393452111,125,73.596,"New Line Cinema, Flynn Picture Company, DC Films, Seven Bucks Productions, Warner Bros. Pictures",United States of America,English,Jaume Collet-Serra,"Adam Sztykiel, Rory Haines, Sohrab Noshirvani","Dwayne Johnson, Aldis Hodge, Pierce Brosnan",6.2,"287,529",41.0,PG-13,1 win & 13 nominations total,39.0,41.0
The Curse of Bridge Hollow,2022-10-14,463,6.53,"Adventure, Comedy, Horror, Family",0,0,89,11.02,Ugly Baby Productions,United States of America,English,Jeff Wadlow,"Todd Berger, Robert Rugan, John R. Morey","Marlon Wayans, Priah Ferguson, Kelly Rowland",5.6,"12,913",38.0,TV-14,,46.0,38.0
The Innocent,2022-10-12,339,6.8,"Comedy, Crime, Romance",4000000,5175806,99,6.064,"Les Films des Tournelles, Auvergne-Rhône-Alpes Cinéma, ARTE France Cinéma",France,"English, French",Louis Garrel,"Louis Garrel, Tanguy Viel, Naïla Guiguet","Louis Garrel, Roschdy Zem, Noémie Merlant",6.7,"4,266",69.0,,4 wins & 16 nominations,98.0,69.0
Simone: Woman of the Century,2022-10-12,350,7.9,"Drama, History",0,0,140,5.462,"Marvelous Productions, SCOPE Pictures, France 2 Cinéma, France 3 Cinéma","Belgium, France",French,Olivier Dahan,Olivier Dahan,"Elsa Zylberstein, Rebecca Marder, Élodie Bouchez",6.8,"1,545",,,2 wins,,
Halloween Ends,2022-10-12,1808,6.1,"Horror, Thriller",20000000,104374176,111,34.053,"Universal Pictures, Blumhouse Productions, Miramax, Rough House Pictures, Trancas International Films",United States of America,English,David Gordon Green,"John Carpenter, Debra Hill, Paul Brad Logan","Jamie Lee Curtis, Andi Matichak, James Jude Courtney",5.0,"76,689",47.0,R,3 wins & 21 nominations total,40.0,47.0
Grimcutty,2022-10-10,382,5.1,Horror,0,0,101,20.266,20th Digital Studio,United States of America,English,John Ross,John Ross,"Shannyn Sossamon, Sara Wolfkind, Usman Ally",4.3,"8,270",,TV-MA,,25.0,
Piggy,2022-10-07,610,6.6,"Horror, Thriller, Drama",2400000,543064,99,20.93,"Morena Films, Backup Media, Cerdita AIE","France, Spain","Spanish, Portuguese",Carlota Pereda,Carlota Pereda,"Laura Galán, Richard Holmes, Carmen Machi",6.2,"14,447",72.0,Not Rated,10 wins & 29 nominations total,91.0,72.0
"Lyle, Lyle, Crocodile",2022-10-07,588,6.969,"Comedy, Family, Music",50000000,104088441,106,25.321,"Eagle Pictures, Columbia Pictures","Italy, United States of America",English,"Josh Gordon, Will Speck","Bernard Waber, William Davies","Javier Bardem, Winslow Fegley, Shawn Mendes",6.1,"16,584",51.0,PG,1 win & 2 nominations total,71.0,51.0
All Quiet on the Western Front,2022-10-07,4030,7.722,"War, History, Drama",20000000,0,147,71.156,"Amusement Park Films, Gunpowder Films",Germany,"French, English, German",Edward Berger,"Edward Berger, Lesley Paterson, Ian Stokell","Felix Kammerer, Albrecht Schuch, Aaron Hilmer",7.8,"267,657",76.0,R,Won 4 Oscars. 59 wins & 89 nominations total,90.0,76.0
Significant Other,2022-10-06,320,6.1,"Science Fiction, Thriller, Horror, Mystery, Drama",0,0,85,22.698,"Paramount Players, Quay Street Productions",United States of America,English,"Dan Berk, Robert Olsen","Dan Berk, Robert Olsen","Maika Monroe, Jake Lacy, Matthew Yang King",5.7,"16,235",57.0,R,,72.0,57.0
God's Crooked Lines,2022-10-06,690,7.333,"Drama, Mystery, Thriller",0,0,155,22.337,"Nostromo Pictures, Atresmedia, Warner Bros. Entertainment España, TV3, Filmayer, Orange",Spain,Spanish,Oriol Paulo,"Oriol Paulo, Guillem Clua, Lara Sendim","Bárbara Lennie, Eduard Fernández, Loreto Mauleón",7.1,"25,304",,TV-MA,4 wins & 20 nominations total,,
20th Century Girl,2022-10-06,712,8.2,"Romance, Drama",119,0,119,92.478,"Yong Film, CJ ENM Studios",South Korea,Korean,Bang Woo-ri,Bang Woo-ri,"Kim Yoo-jung, Byeon Woo-seok, Park Jung-woo",7.4,"11,556",,TV-PG,2 nominations total,86.0,
The Stranger,2022-10-06,327,6.2,"Thriller, Crime, Drama",0,149441,117,16.611,"Anonymous Content, See-Saw Films, Screen Australia, South Australian Film Corporation, Blue-Tongue Films, RocketScience","Australia, United Kingdom, United States of America",English,Thomas M. Wright,"Thomas M. Wright, Kate Kyriacou","Joel Edgerton, Sean Harris, Jada Alberts",6.6,"27,910",74.0,TV-MA,14 wins & 18 nominations total,92.0,74.0
Terrifier 2,2022-10-06,2178,6.7,"Horror, Thriller",250000,15741780,138,73.879,"Dark Age Cinema, Fuzz on the Lens Productions, Bloody Disgusting, The Coven, Gelt Films",United States of America,English,Damien Leone,Damien Leone,"Lauren LaVera, David Howard Thornton, Elliott Fullam",6.1,"69,179",59.0,Not Rated,6 wins & 12 nominations total,86.0,59.0
November,2022-10-05,756,7.078,"Crime, Drama, Thriller",17700000,18114769,105,10.86,"Chi-Fou-Mi Productions, Récifilms, uMedia, France 2 Cinéma, uFund, Canal+, La Banque Postale Image, StudioCanal","Belgium, France","Arabic, French",Cédric Jimenez,"Olivier Demangel, Cédric Jimenez, LB","Jean Dujardin, Anaïs Demoustier, Sandrine Kiberlain",6.7,"6,674",,,8 nominations total,78.0,
Mr. Harrigan's Phone,2022-10-05,843,6.4,"Drama, Horror, Mystery",0,0,105,14.081,"Ryan Murphy Television, Blumhouse Television",United States of America,English,John Lee Hancock,"John Lee Hancock, Stephen King","Donald Sutherland, Jaeden Martell, Joe Tippett",6.0,"41,035",55.0,PG-13,,46.0,55.0
Luckiest Girl Alive,2022-09-30,843,6.5,"Drama, Thriller, Mystery",0,0,113,12.218,"Orchard Farm Productions, Made Up Stories, Picturestart",United States of America,English,Mike Barker,Jessica Knoll,"Mila Kunis, Chiara Aurelia, Finn Wittrock",6.4,"57,168",54.0,R,2 wins & 3 nominations,43.0,54.0
Sick of Myself,2022-09-30,307,7.208,"Comedy, Drama",0,1051375,97,9.586,"Oslo Pictures, Garagefilm International, Film i Väst, Eye Eye Pictures","Norway, Sweden","English, Norwegian, Swedish",Kristoffer Borgli,Kristoffer Borgli,"Kristine Kujath Thorp, Eirik Sæther, Fanny Vaager",7.1,"18,415",71.0,,7 wins & 10 nominations,88.0,71.0
EO,2022-09-30,336,6.519,"Drama, Adventure",0,1068353,88,7.399,"Skopia Film, Alien Films, HAKA Films, MiC, Regione Lazio","Italy, Poland","Italian, Spanish, French, Polish, English",Jerzy Skolimowski,"Ewa Piaskowska, Jerzy Skolimowski","Hola, Tako, Marietta",6.7,"15,323",85.0,Not Rated,Nominated for 1 Oscar. 31 wins & 65 nominations total,96.0,85.0
Bros,2022-09-30,509,6.7,"Comedy, Romance",22000000,14800000,115,16.464,"Universal Pictures, Apatow Productions, Stoller Global Solutions",United States of America,English,Nicholas Stoller,"Billy Eichner, Nicholas Stoller","Billy Eichner, Luke Macfarlane, Guy Branum",6.4,"37,422",72.0,R,2 wins & 16 nominations total,89.0,72.0
Serial (Bad) Weddings 3,2021-12-21,382,6.3,"Romance, Comedy",22000000,27832384,97,18.014,"UGC, Orange Studio",France,French,Philippe de Chauveron,"Guy Laurent, Philippe de Chauveron","Christian Clavier, Chantal Lauby, Ary Abittan",6.1,"4,238",,,,,
Dry,2022-09-29,307,6.454,"Drama, Comedy, Science Fiction",0,1907869,124,5.715,"Vision Distribution, Wildside, Sky Italia, MiC, Regione Lazio, Flat Parioli, Sky, Sky Cinema",Italy,Italian,Paolo Virzì,"Paolo Giordano, Paolo Virzì, Francesca Archibugi","Silvio Orlando, Valerio Mastandrea, Elena Lietti",6.2,"2,175",,,7 wins & 8 nominations,,
Argentina 1985,2022-09-29,642,7.862,"Drama, History, Crime",20000000,58424000,141,11.234,"La Unión de los Ríos, Kenya Films, Infinity Hill, Wanka Cine, Infinity Hill","Argentina, United Kingdom",Spanish,Santiago Mitre,"Santiago Mitre, Mariano Llinás, Martín Mauregui","Ricardo Darín, Gina Mastronicola, Francisco Bertín",7.6,"32,935",78.0,R,Nominated for 1 Oscar. 49 wins & 45 nominations total,96.0,78.0
Entergalactic,2022-09-28,381,7.668,"Animation, Romance, Music",0,0,93,17.945,"Khalabo Ink Society, Mad Solar, DNEG","Canada, United Kingdom, United States of America",English,Fletcher Moules,"Kid Cudi, Kenya Barris, Ian Edelman","Kid Cudi, Jessica Williams, Laura Harrier",7.3,"16,862",,TV-MA,Won 1 Primetime Emmy. 2 wins & 8 nominations total,97.0,
Hellraiser,2022-09-28,851,6.2,"Horror, Mystery",14000000,0,121,23.603,"Phantom Four, Spyglass Media Group",United States of America,English,David Bruckner,"Ben Collins, Luke Piotrowski, David S. Goyer","Odessa A'zion, Jamie Clayton, Adam Faison",5.9,"51,093",55.0,R,1 win & 9 nominations total,,55.0
Amsterdam,2022-09-27,1553,6.059,"Mystery, Comedy, Drama",80000000,31245810,134,20.25,"DreamCrew, Keep Your Head Productions, Corazon Hayagriva, New Regency Productions, Regency Enterprises",United States of America,"English, French",David O. Russell,David O. Russell,"Christian Bale, Margot Robbie, John David Washington",6.1,"98,679",49.0,R,Nominated for 1 BAFTA Award2 wins & 12 nominations total,31.0,49.0
Hocus Pocus 2,2022-09-27,1695,7.219,"Fantasy, Comedy, Family",30000000,0,107,33.909,"Walt Disney Pictures, Weimaraner Republic Pictures",United States of America,English,Anne Fletcher,"Jen D'Angelo, David Kirschner, Blake Harris","Bette Midler, Sarah Jessica Parker, Kathy Najimy",6.0,"55,742",56.0,PG,Nominated for 3 Primetime Emmys. 2 wins & 18 nominations total,65.0,56.0
Werewolf by Night,2022-09-25,1315,6.991,"Action, Fantasy, Horror",0,0,55,27.809,"Marvel Studios, Kevin Feige Productions",United States of America,English,Michael Giacchino,"Heather Quinn, Peter Cameron, Roy Thomas","Gael García Bernal, Laura Donnelly, Harriet Sansom Harris",7.1,"73,992",,TV-14,1 win & 5 nominations total,90.0,
The Offering,2022-09-23,332,6.0,"Drama, Horror",0,0,93,17.903,Millennium Media,United States of America,"English, Hebrew",Oliver Park,"Hank Hoffman, Jonathan Yunger","Nick Blood, Emily Wiseman, Paul Kaye",5.3,"7,656",60.0,R,,76.0,60.0
Smile,2022-09-23,3452,6.7,"Horror, Mystery",17000000,217408513,115,90.893,"Paramount Players, Temple Hill Entertainment",United States of America,English,Parker Finn,Parker Finn,"Sosie Bacon, Jessie T. Usher, Kyle Gallner",6.5,"205,870",68.0,R,3 wins & 23 nominations total,79.0,68.0
Bandit,2022-09-23,344,6.2,"Crime, Drama, Thriller",0,0,126,17.314,"Goldrush Entertainment, Yale Productions, Lucky 13 Productions, BondIt Media Capital","Canada, United States of America","English, Spanish",Allan Ungar,"Kraig Wenman, Robert Knuckle, Ed Arnold","Josh Duhamel, Elisha Cuthbert, Nestor Carbonell",6.4,"14,677",54.0,R,1 win total,74.0,54.0
TÁR,2022-09-23,1293,7.088,"Music, Drama",35000000,29048571,158,20.872,"Focus Features, Standard Film Company, EMJAG Productions",United States of America,"English, French, German, Portuguese, Tagalog, Tamil",Todd Field,Todd Field,"Cate Blanchett, Noémie Merlant, Nina Hoss",7.4,"100,593",93.0,R,Nominated for 6 Oscars. 80 wins & 274 nominations total,,93.0
The Greatest Beer Run Ever,2022-09-23,762,7.602,"Drama, Comedy, War",2800000,0,126,23.625,Skydance Media,United States of America,"English, Vietnamese",Peter Farrelly,"Peter Farrelly, Brian Hayes Currie, Pete Jones","Zac Efron, Russell Crowe, Jake Picking",6.8,"31,571",39.0,R,2 nominations total,43.0,39.0
Lou,2022-09-23,670,6.5,"Action, Thriller",0,0,107,19.113,Bad Robot,United States of America,English,Anna Foerster,"Maggie Cohn, Jack Stanley","Allison Janney, Jurnee Smollett, Logan Marshall-Green",6.1,"35,511",51.0,R,1 win total,69.0,51.0
The Enforcer,2022-09-22,397,7.0,"Action, Crime, Drama",1261569,0,91,18.501,"Born to Burn Films, Millennium Media",United States of America,"English, Spanish",Richard Hughes,W. Peter Iliff,"Antonio Banderas, Mojean Aria, Kate Bosworth",5.3,"5,381",38.0,R,,32.0,38.0
Project Wolf Hunting,2022-09-21,371,6.4,"Action, Thriller, Horror, Crime",9000000,20541,122,59.137,"The Contents On, Contents G, Cheum Film, Finecut",South Korea,"Korean, English, Japanese",Hongsun Kim,Hongsun Kim,"Seo In-guk, Jang Dong-yoon, Jung So-min",6.0,"7,941",53.0,18+,1 win & 2 nominations total,,53.0
Don't Worry Darling,2022-09-21,2563,6.8,"Mystery, Thriller",35000000,86700000,123,31.311,"Vertigo Entertainment, New Line Cinema, Warner Bros. Pictures",United States of America,English,Olivia Wilde,"Katie Silberman, Carey Van Dyke, Shane Van Dyke","Florence Pugh, Harry Styles, Chris Pine",6.3,"158,367",48.0,R,10 wins & 22 nominations total,38.0,48.0
Triangle of Sadness,2022-09-18,2301,7.068,"Comedy, Drama",15600000,24733572,147,33.756,"30WEST, BBC Film, Bord Cadre Films, Coproduction Office, Film i Väst, Heretic, Imperative Entertainment, Sovereign Films, Plattform Produktion, SVT, BFI, Piano, ARTE France Cinéma, ZDF/Arte, Essential Filmproduktion, TRT Sinema","Denmark, France, Germany, Greece, Mexico, Sweden, Switzerland, Turkey, United Kingdom, United States of America","Akan, English, French, German, Greek, Swedish, Tagalog",Ruben Östlund,Ruben Östlund,"Thobias Thorwid, Harris Dickinson, Charlbi Dean",7.3,"195,905",63.0,R,Nominated for 3 Oscars. 25 wins & 81 nominations total,72.0,63.0
