title,release_date,tmdb_vote_count,tmdb_vote_average,genre_names,budget,revenue,runtime_in_min,tmdb_popularity,production_company_name,production_country_name,spoken_languages,director,writer,actors,imdb_rating,imdb_votes,metascore,age_rating,awards,rotten_tomatoes_rating,meta_critic_rating
Chernobyl: Abyss,2021-04-15,515,6.3,"Drama, History, Adventure, Action, Fantasy, Mystery",9100000,6459306,136,30.25,"Non-Stop Productions, DK Entertainment, Central Partnership, KIT Film Studio, Kinoprime Foundation",Russia,"English, Russian",Danila Kozlovskiy,"Djamel Bennecib, Elena Ivanova, Aleksey Kazakov","Danila Kozlovskiy, Oksana Akinshina, Filipp Avdeev",5.2,"10,805",,,,,
Cyrano,2021-04-14,301,6.382,"Drama, Romance",20000000,3000000,122,9.635,"Metro-Goldwyn-Mayer, Working Title Films, Bron Studios, Creative Wealth Media Finance","Canada, United Kingdom, United States of America",English,Joe Wright,"Erica Schmidt, Edmond Rostand","Peter Dinklage, Haley Bennett, Kelvin Harrison Jr.",6.4,"15,347",66.0,PG-13,Nominated for 1 Oscar. 9 wins & 47 nominations total,85.0,66.0
Wheel of Fortune and Fantasy,2021-04-11,307,7.14,"Drama, Romance",0,1548033,121,12.088,"Neopa, Fictive",Japan,Japanese,Ryûsuke Hamaguchi,Ryûsuke Hamaguchi,"Kotone Furukawa, Ayumu Nakajima, Hyunri",7.5,"10,416",86.0,,10 wins & 22 nominations total,99.0,86.0
The Swarm,2021-04-09,470,5.771,"Horror, Drama",0,0,101,14.815,"Capricci Films, The Jokers Films, ARTE France Cinéma, Auvergne-Rhône-Alpes Cinéma",France,French,Just Philippot,"Jérôme Genevray, Franck Victor","Suliane Brahim, Sofian Khammes, Marie Narbonne",5.3,"8,244",,,2 wins & 6 nominations,67.0,
Thunder Force,2021-04-09,1244,5.5,"Comedy, Action, Adventure, Science Fiction",0,0,107,11.975,"Marc Platt Productions, On the Day",United States of America,English,Ben Falcone,Ben Falcone,"Melissa McCarthy, Octavia Spencer, Jason Bateman",4.6,"46,278",34.0,PG-13,1 nomination,22.0,34.0
Voyagers,2021-04-08,882,6.0,"Science Fiction, Thriller",20000000,4298184,108,23.797,"Nota Bene, Thunder Road","Czech Republic, Romania, United Kingdom, United States of America",English,Neil Burger,Neil Burger,"Colin Farrell, Tye Sheridan, Lily-Rose Depp",5.5,"28,306",44.0,PG-13,,24.0,44.0
Mortal Kombat,2021-04-07,5905,7.025,"Action, Fantasy, Adventure",20000000,84426031,110,41.031,"Atomic Monster, Broken Road Productions, New Line Cinema",United States of America,"Japanese, English, Mandarin",Simon McQuoid,"Greg Russo, Dave Callaham, Oren Uziel","Lewis Tan, Jessica McNamee, Josh Lawson",6.0,"194,432",44.0,R,4 wins & 9 nominations total,55.0,44.0
The Old Ways,2021-04-04,334,6.778,"Horror, Fantasy",0,0,90,8.695,Soapbox Films,United States of America,"English, Spanish",Christopher Alender,Marcos Gabriel,"Brigitte Kali Canales, Andrea Cortés, Julia Vera",5.4,"8,168",67.0,R,2 wins & 1 nomination,,67.0
Monster Pets: A Hotel Transylvania Short,2021-04-02,396,7.4,"Animation, Comedy, Fantasy",0,0,6,20.158,"Columbia Pictures, Sony Pictures Animation",United States of America,English,"Derek Drymon, Jennifer Kluska",Jennifer Kluska,"Brian Hull, Derek Drymon, Jennifer Kluska",6.6,"1,237",,G,,,
The Monkey King: Reborn,2021-04-02,324,7.2,"Animation, Action, Fantasy, Family",20000000,0,95,34.466,"Filmko Film, ITS CARTOON",China,Mandarin,Yunfei Wang,"Yunfei Wang, Cheng'en Wu, Xiaoyu Wu","Yenni Ann, Xuecen Bai, Zhongyang Baomu",6.0,597,,Not Rated,,,
Major Grom: Plague Doctor,2021-04-01,600,6.705,"Action, Adventure",10000000,4500000,136,17.114,"Bubble Studios, Plus Studio",Russia,Russian,Oleg Trofim,"Vladimir Besedin, Evgeny Eronin, Artyom Gabrelyanov","Tikhon Zhiznevskiy, Lyubov Aksyonova, Sergei Goroshko",6.3,"14,149",,TV-14,1 nomination,,
The Unholy,2021-03-31,2174,6.6,"Horror, Mystery",10000000,30800000,99,30.006,"Ghost House Pictures, Screen Gems",United States of America,"English, Latin",Evan Spiliotopoulos,"Evan Spiliotopoulos, James Herbert","Jeffrey Dean Morgan, Cricket Brown, William Sadler",5.1,"29,145",36.0,PG-13,1 nomination total,28.0,36.0
Last Man Down,2021-03-30,677,6.2,"Action, Thriller, Mystery",0,0,87,33.102,"Daniel Stisen Productions, Fansu Film, Fabrication Films","Sweden, United Kingdom, United States of America",English,Fansu Njie,"Fansu Njie, Daniel Stisen, Andreas Vasshaug","Daniel Stisen, Olga Kent, Daniel Nehme",3.5,"14,149",,R,,,
A Week Away,2021-03-26,389,6.9,"Drama, Music, Romance, Comedy",0,0,94,11.653,"Monarch Media, Rove Productions",United States of America,English,Roman White,"Alan Powell, Kali Bailey, Gabe Vasquez","Kevin Quinn, Bailee Madison, Jahbril Cook",5.8,"5,616",32.0,TV-PG,1 nomination total,58.0,32.0
Shiva Baby,2021-03-26,647,7.181,"Comedy, Drama",250000,359247,78,12.953,"Neon Heart Productions, Dimbo Pictures, It Doesn't Suck Productions, Bad Mensch Productions, Thick Media, Irving Harvey",United States of America,"English, Hebrew",Emma Seligman,Emma Seligman,"Rachel Sennott, Danny Deferrari, Fred Melamed",7.1,"37,084",79.0,Not Rated,12 wins & 43 nominations total,96.0,79.0
Bad Trip,2021-03-26,530,6.1,Comedy,0,0,87,10.152,"Orion Pictures, Bron Studios, Creative Wealth Media Finance, The District, Gorilla Flicks","Canada, United States of America",English,Kitao Sakurai,"Eric André, Kitao Sakurai, Andrew Barchilon","Eric André, Michaela Conlin, Lil Rel Howery",6.5,"27,921",61.0,Unrated,1 nomination,80.0,61.0
Peter Rabbit 2: The Runaway,2021-03-25,812,7.1,"Family, Adventure, Animation",45000000,153000000,93,27.8,"Columbia Pictures, Olive Bridge Entertainment, Animal Logic, MRC, 2.0 Entertainment","Australia, United States of America",English,Will Gluck,"Will Gluck, Patrick Burleigh, Beatrix Potter","Rose Byrne, Domhnall Gleeson, David Oyelowo",6.2,"15,418",43.0,PG,2 wins & 6 nominations total,68.0,43.0
Godzilla vs. Kong,2021-03-24,10085,7.584,"Action, Science Fiction, Adventure",200000000,470116094,114,54.772,Legendary Pictures,United States of America,English,Adam Wingard,"Terry Rossio, Michael Dougherty, Zach Shields","Alexander Skarsgård, Millie Bobby Brown, Rebecca Hall",6.3,"253,500",59.0,PG-13,3 wins & 20 nominations total,76.0,59.0
Seaspiracy,2021-03-23,419,7.856,"Documentary, Crime",0,0,89,8.794,"A.U.M. Films, Disrupt Studios","Faeroe Islands, Japan, United Kingdom, United States of America",English,Ali Tabrizi,,"Ali Tabrizi, Richard O'Barry, Lucy Tabrizi",8.1,"34,660",,TV-14,1 nomination,75.0,
Deadly Illusions,2021-03-18,325,5.0,"Thriller, Drama",0,0,114,19.291,"Kiss and Tale Productions, Voltage Pictures",United States of America,English,Anna Elizabeth James,Anna Elizabeth James,"Kristin Davis, Dermot Mulroney, Greer Grammer",3.8,"13,950",,R,,,
Secret Magic Control Agency,2021-03-18,372,7.023,"Animation, Comedy, Fantasy",0,0,104,14.307,"CTB Film Company, Voronezh Animation Studio, QED International, Kinoprime Foundation, Cinema Foundation of Russia, Columbia Pictures","Russia, United States of America","Russian, French, English, Portuguese",Alex Tsitsilin,"Alex Tsitsilin, Vladimir Nikolaev, Aleksey Zamyslov","Nicholas Corda, Sylvana Joyce, Alyson Leigh Rosenfeld",6.2,"4,915",,TV-Y7,2 wins & 1 nomination,,
Zack Snyder's Justice League,2021-03-18,10121,8.1,"Action, Adventure, Fantasy",70000000,0,242,70.631,"Warner Bros. Pictures, The Stone Quarry, Atlas Entertainment, Access Entertainment, Dune Entertainment, DC Films",United States of America,English,Zack Snyder,"Jerry Siegel, Joe Shuster, Zack Snyder","Henry Cavill, Ben Affleck, Gal Gadot",7.9,"449,643",54.0,R,5 wins & 6 nominations total,71.0,54.0
Nobody,2021-03-18,7218,7.934,"Action, Thriller",17000000,61779301,92,55.996,"87North Productions, Odenkirk Provissiero Entertainment, Eighty Two Films",United States of America,"English, Russian, Spanish",Ilya Naishuller,Derek Kolstad,"Bob Odenkirk, Aleksey Serebryakov, Connie Nielsen",7.4,"342,582",64.0,R,5 wins & 18 nominations total,84.0,64.0
The Fallout,2021-03-17,1156,7.587,Drama,0,0,96,37.343,"Clear Horizon Entertainment, SSS Entertainment",United States of America,English,Megan Park,Megan Park,"Jenna Ortega, Maddie Ziegler, Niles Fitch",7.0,"36,365",84.0,R,6 wins & 8 nominations,91.0,84.0
Paper Lives,2021-03-12,382,8.0,Drama,0,0,96,18.643,"OGM Pictures, OG Medya",Turkey,Turkish,Can Ulkay,Ercan Mehmet Erdem,"Çagatay Ulusoy, Emir Ali Dogrul, Ersin Arici",6.6,"14,096",,TV-MA,5 wins & 2 nominations,,
Cosmic Sin,2021-03-12,550,4.013,"Science Fiction, Action, Adventure",20000000,349757,88,15.879,"308 Enterprises, BondIt Media Capital, Buffalo 8, The Exchange",United States of America,English,Edward Drake,"Edward Drake, Corey Large","Frank Grillo, Bruce Willis, Brandon Thomas Lee",2.5,"15,486",9.0,R,1 nomination total,6.0,9.0
YES DAY,2021-03-11,1209,6.7,"Family, Comedy",0,0,86,18.356,"Entertainment 360, Grey Matter Productions",United States of America,English,Miguel Arteta,"Justin Malen, Amy Krouse Rosenthal, Tom Lichtenheld","Jennifer Garner, Edgar Ramírez, Jenna Ortega",5.7,"31,311",46.0,PG,2 nominations,52.0,46.0
Evangelion: 3.0+1.0 Thrice Upon a Time,2021-03-08,824,8.2,"Animation, Action, Science Fiction, Drama",29700000,93882453,155,30.261,khara,Japan,Japanese,"Mahiro Maeda, Katsuichi Nakayama, Kazuya Tsurumaki","Hideaki Anno, Kazuya Tsurumaki, Yôji Enokido","Megumi Ogata, Megumi Hayashibara, Yûko Miyamura",8.0,"15,571",85.0,TV-MA,4 wins & 4 nominations total,100.0,85.0
Sentinelle,2021-03-05,594,5.9,"Thriller, Action, Drama",6500000,0,80,12.182,Labyrinthe Films,France,French,Julien Leclercq,"Julien Leclercq, Matthieu Serveau","Olga Kurylenko, Marilyn Lima, Michel Nabokoff",4.8,"8,952",,TV-MA,,70.0,
The Vault,2021-03-04,964,6.811,"Drama, Action, Thriller",15000000,8804000,114,27.643,"Ciudadano Ciskul, Telecinco Cinema, Think Studio, TF1 Studio, Mediaset España, Movistar+, Marrowbone","France, Spain","English, Italian, Spanish",Jaume Balagueró,"Rafa Martínez, Andrés M. Koppel, Borja Glez. Santaolalla","Freddie Highmore, Astrid Bergès-Frisbey, Sam Riley",6.4,"32,822",50.0,R,2 wins,60.0,50.0
Coming 2 America,2021-03-04,2248,6.4,Comedy,60000000,0,110,34.568,"Paramount Pictures, New Republic Pictures, Eddie Murphy Productions, Misher Films",United States of America,English,Craig Brewer,"Eddie Murphy, Barry W. Blaustein, David Sheffield","Eddie Murphy, Arsenio Hall, Shari Headley",5.3,"77,886",52.0,PG-13,Nominated for 1 Oscar. 6 wins & 11 nominations total,49.0,52.0
Us Again,2021-03-03,327,7.8,"Animation, Drama, Family, Romance",0,0,7,16.492,"Walt Disney Pictures, Walt Disney Animation Studios",United States of America,English,Zach Parrish,Zach Parrish,,7.8,"7,536",,G,3 wins & 1 nomination total,,
Moxie,2021-03-03,800,7.3,"Comedy, Drama, Music",0,0,111,11.926,Paper Kite Productions,United States of America,English,Amy Poehler,"Jennifer Mathieu, Tamara Chestna, Dylan Meyer","Hadley Robinson, Lauren Tsai, Alycia Pascual-Pena",6.7,"29,348",54.0,PG-13,,70.0,54.0
Raya and the Last Dragon,2021-03-03,6857,7.8,"Animation, Family, Fantasy, Action, Adventure",100000000,130423032,107,80.7,"Walt Disney Pictures, Walt Disney Animation Studios",United States of America,English,"Don Hall, Carlos López Estrada, Paul Briggs","Qui Nguyen, Adele Lim, Paul Briggs","Kelly Marie Tran, Awkwafina, Gemma Chan",7.3,"177,636",74.0,PG,Nominated for 1 Oscar. 13 wins & 62 nominations total,93.0,74.0
Girl in the Basement,2021-02-27,722,7.637,"Thriller, Crime, TV Movie",0,0,88,96.558,"Big Dreams Entertainment, Swirl Films",United States of America,English,Elisabeth Röhm,Barbara Marshall,"Judd Nelson, Stefanie Scott, Joely Fisher",6.3,"15,317",,TV-14,1 nomination total,,
Crazy About Her,2021-02-26,459,7.229,"Comedy, Romance",0,0,102,7.475,"Sábado Películas, Loco Por Ti AIE",Spain,Spanish,Dani de la Orden,"Natalia Durán, Eric Navarro","Álvaro Cervantes, Susana Abaitua, Luis Zahera",6.6,"6,662",,TV-MA,,,
"Quo Vadis, Aida?",2021-02-26,408,7.645,"War, Drama, History",4750000,813253,104,10.346,"Deblokada, Digital Cube, N279 Entertainment, Extreme Emotions, Razor Film Produktion, Tordenfilm, Coop99 Filmproduktion, Indie Prod, TRT Türkiye Radyo Televizyon Kurumu","Austria, Bosnia and Herzegovina, France, Germany, Netherlands, Norway, Poland, Romania, Turkey","Bosnian, Dutch, English, Serbian, Serbo-Croatian",Jasmila Zbanic,"Jasmila Zbanic, Hasan Nuhanovic","Jasna Djuricic, Izudin Bajrovic, Boris Ler",8.0,"39,797",97.0,TV-MA,Nominated for 1 Oscar. 40 wins & 43 nominations total,100.0,97.0
Billie Eilish: The World's a Little Blurry,2021-02-26,306,8.3,"Documentary, Music",0,0,140,16.53,"Interscope Films, This Machine Filmworks, Lighthouse Management + Media, Matador Content, Darkroom",United States of America,"German, Maori, English",R.J. Cutler,R.J. Cutler,"Billie Eilish, Finneas O'Connell, Maggie Baird",7.7,"9,097",70.0,R,Nominated for 4 Primetime Emmys. 19 nominations total,96.0,70.0
The Little Things,2021-01-28,2543,6.336,"Drama, Crime, Thriller",30000000,29942746,128,26.959,"Warner Bros. Pictures, Gran Via Productions",United States of America,English,John Lee Hancock,John Lee Hancock,"Denzel Washington, Rami Malek, Jared Leto",6.3,"132,358",54.0,R,1 win & 2 nominations total,44.0,54.0
Crisis,2021-02-26,355,6.3,"Thriller, Crime, Drama",0,1099426,118,13.864,"Bideford Productions, Burn Later Productions, Construction Film, Green Room Films, Matisse Pictures, Tuesday Films, Les Productions LOD, Paradise City Films","Belgium, Canada","German, English",Nicholas Jarecki,Nicholas Jarecki,"Gary Oldman, Armie Hammer, Evangeline Lilly",6.2,"14,574",41.0,R,1 win & 1 nomination total,66.0,41.0
Cherry,2021-02-26,1281,7.351,"Drama, Crime",40000000,0,140,26.7,"AGBO, The Hideaway Entertainment",United States of America,English,"Anthony Russo, Joe Russo","Angela Russo-Otstot, Jessica Goldberg, Nico Walker","Tom Holland, Ciara Bravo, Jack Reynor",6.6,"38,959",44.0,R,3 wins & 5 nominations total,37.0,44.0
Chaos Walking,2021-02-24,2318,6.6,"Fantasy, Science Fiction, Adventure",125000000,26508132,109,40.96,"Quadrant Pictures, Lionsgate, Bron Studios, 3 Arts Entertainment, TIK Films, Hercules Film Fund, Allison Shearmur Productions, Creative Wealth Media Finance","Canada, Hong Kong, Luxembourg, United States of America",English,Doug Liman,"Patrick Ness, Christopher Ford","Tom Holland, Daisy Ridley, Demián Bichir",5.7,"58,745",38.0,PG-13,2 wins total,21.0,38.0
I Care a Lot,2021-02-19,2717,6.6,"Crime, Thriller, Drama",0,0,119,18.736,"STXfilms, Black Bear Pictures, Crimple Beck","United Kingdom, United States of America",English,J Blakeson,J Blakeson,"Rosamund Pike, Peter Dinklage, Eiza González",6.4,"150,436",66.0,R,1 win & 6 nominations,79.0,66.0
Boss Level,2021-02-19,1655,6.869,"Action, Science Fiction, Thriller",45000000,2000000,101,24.636,"WarParty Films, Highland Film Group, Ingenious Media, EFO Films, Big Red Films, Diamond Film Productions, Edver Films, River Bay Films, The Fyzz, Scott Free Productions, MoviePass Films","United Kingdom, United States of America",English,Joe Carnahan,"Chris Borey, Eddie Borey, Joe Carnahan","Frank Grillo, Mel Gibson, Naomi Watts",6.8,"82,930",56.0,TV-MA,,74.0,56.0
The Map of Tiny Perfect Things,2021-02-12,783,7.1,"Fantasy, Romance",0,0,99,15.707,"Weed Road Pictures, FilmNation Entertainment, Wishmore",United States of America,English,Ian Samuels,Lev Grossman,"Kathryn Newton, Kyle Allen, Jermaine Harris",6.8,"29,665",61.0,PG-13,1 nomination total,78.0,61.0
The Mauritanian,2021-02-12,1115,7.422,"Drama, Thriller",0,7527030,129,18.749,"30WEST, Topic Studios, STXfilms, SunnyMarch, BBC Film, Shadowplay Features","United Kingdom, United States of America","German, Arabic, French, English",Kevin Macdonald,"Michael Bronner, Rory Haines, Sohrab Noshirvani","Tahar Rahim, Nouhe Hamady Bari, Saadna Hamoud",7.5,"65,856",53.0,R,Nominated for 5 BAFTA 6 wins & 19 nominations total,75.0,53.0
Willy's Wonderland,2021-02-12,1011,6.019,"Action, Horror, Comedy, Thriller",5000000,431020,88,18.961,"Saturn Films, JD Entertainment, Landafar Entertainment, Landmark Studio Group, Almost Never Films",United States of America,"English, Spanish",Kevin Lewis,G.O. Parsons,"Nicolas Cage, Emily Tosta, Beth Grant",5.5,"41,097",44.0,TV-MA,2 nominations total,61.0,44.0
Minari,2021-02-12,1631,7.338,Drama,2000000,12900000,115,25.375,Plan B Entertainment,United States of America,"English, Korean",Lee Isaac Chung,Lee Isaac Chung,"Steven Yeun, Han Ye-ri, Alan Kim",7.4,"101,764",89.0,PG-13,Won 1 Oscar. 122 wins & 245 nominations total,98.0,89.0
To All the Boys: Always and Forever,2021-02-12,1946,7.525,"Romance, Comedy, Drama",0,0,115,31.814,"Awesomeness Films, ACE Entertainment",United States of America,"English, Korean",Michael Fimognari,"Katie Lovejoy, Jenny Han","Lana Condor, Noah Centineo, Janel Parrish",6.3,"35,755",65.0,TV-14,2 wins & 2 nominations total,79.0,65.0
A Writer's Odyssey,2021-02-12,305,7.077,"Fantasy, Action, Adventure, Drama",0,150123320,130,28.6,"United Entertainment Partners, 华策影业（上海）有限公司, Free Whale Pictures",China,Mandarin,"Zhuang Jieqiong, Yang Lu","Shu Chen, Yang Yu, Haiyan Qin","Jiayin Lei, Mi Yang, Zijian Dong",6.2,"4,523",,,14 wins & 35 nominations total,93.0,
Fear of Rain,2021-02-12,530,6.938,"Thriller, Horror, Drama",0,24565,109,13.415,"Pinstripe Productions, Sweet Tomato Films, Zero Gravity Management, Hungry Bull Productions, Mirror Image Films, Voltage Pictures",United States of America,English,Castille Landon,Castille Landon,"Katherine Heigl, Harry Connick Jr., Madison Iseman",5.9,"10,205",,PG-13,1 nomination,47.0,
Rumble,2021-02-12,512,6.798,"Animation, Family",0,0,95,20.584,"Paramount Animation, Reel FX Creative Studios, WWE Studios, Walden Media, Paramount Pictures",United States of America,English,Hamish Grieve,"Hamish Grieve, Matt Lieberman, Rob Harrell","Geraldine Viswanathan, Will Arnett, Stephen A. Smith",5.9,"9,012",48.0,PG,,47.0,48.0
Judas and the Black Messiah,2021-02-12,1547,7.318,"Drama, History",26000000,6416063,126,21.122,"MACRO, Bron Studios, Participant, Proximity Media","Canada, United States of America",English,Shaka King,"Will Berson, Shaka King, Kenneth Lucas","LaKeith Stanfield, Daniel Kaluuya, Jesse Plemons",7.4,"93,789",84.0,R,Won 2 Oscars. 45 wins & 90 nominations total,96.0,84.0
The World to Come,2021-02-12,348,7.0,"Romance, Drama, Western",0,0,105,12.756,"Killer Films, M.Y.R.A. Entertainment, Yellow Bear Films, Hype Film, Charades, Ingenious Media, Sea Change Media, Sailor Bear","France, Romania, Russia, United States of America",English,Mona Fastvold,"Ron Hansen, Jim Shepard","Katherine Waterston, Vanessa Kirby, Casey Affleck",6.4,"11,820",73.0,R,5 wins & 8 nominations total,74.0,73.0
Squared Love,2021-02-11,314,6.1,"Romance, Comedy",0,0,102,12.917,Endemol Shine Polska,Poland,"English, German, Polish",Filip Zylber,"Wiktor Piatkowski, Marzanna Polit","Adrianna Chlebicka, Mateusz Banasiuk, Agnieszka Zulewska",5.1,"3,909",,TV-14,,20.0,
Red Dot,2021-02-11,697,5.895,"Thriller, Horror",0,0,86,16.858,"Film i Dalarna, SF Studios",Sweden,"Swedish, English",Alain Darborg,"Alain Darborg, Per Dickson","Nanna Blondell, Anastasios Soulis, Thomas Hanzon",5.5,"15,083",,TV-MA,1 nomination,75.0,
Tom & Jerry,2021-02-10,2461,6.769,"Comedy, Family, Animation",50000000,136536687,101,40.623,"Warner Bros. Pictures Animation, Turner Entertainment, The Story Company, Warner Bros. Pictures",United States of America,English,Tim Story,"William Hanna, Joseph Barbera, Kevin Costello","Chloë Grace Moretz, Michael Peña, Colin Jost",5.3,"40,799",32.0,PG,7 nominations,29.0,32.0
AINBO: Spirit of the Amazon,2021-02-09,438,7.0,"Adventure, Animation, Family, Fantasy",10000000,10237061,84,20.25,Tunche Films,Peru,English,"Richard Claus, Jose Zelada","Richard Claus, Brian Cleveland, Jason Cleveland","Lola Raie, Naomi Serrano, Dino Andrade",4.9,"2,374",,TV-Y7,1 win total,,
New Gods: Nezha Reborn,2021-02-06,441,8.1,"Animation, Action, Fantasy",0,0,116,70.671,"bilibili, Alibaba Pictures Group, Light Chaser Animation Studios",China,"Mandarin, Portuguese",Ji Zhao,"Muchuan, Zhonglin Xu","Nicole Fong, Victoria Grace, Jason Ko",6.8,"4,075",,TV-14,3 wins & 3 nominations total,80.0,
Bliss,2021-02-05,615,5.5,"Science Fiction, Romance, Drama",0,0,103,25.524,"Amazon Studios, Endgame Entertainment, Big Indie Pictures",United States of America,English,Mike Cahill,Mike Cahill,"Owen Wilson, Salma Hayek, Nesta Cooper",5.4,"20,834",40.0,R,1 win & 2 nominations total,86.0,40.0
Space Sweepers,2021-02-05,1040,7.07,"Drama, Fantasy, Science Fiction",21000000,24571,136,25.155,"Bidangil Pictures, Merry Christmas",South Korea,"Arabic, Mandarin, Korean, Danish, Spanish, French, English, Russian, Tagalog",Sung-hee Jo,"Sung-hee Jo, Seung-min Yoon, Seo-ae Yoo-Kang","Song Joong-ki, Kim Tae-ri, Jin Seon-kyu",6.5,"29,661",64.0,TV-MA,7 wins & 17 nominations total,70.0,64.0
Malcolm & Marie,2021-01-29,1392,7.024,"Drama, Romance",2500000,0,106,15.808,Little Lamb Productions,United States of America,English,Sam Levinson,Sam Levinson,"John David Washington, Zendaya",6.6,"42,160",53.0,R,4 wins & 9 nominations total,57.0,53.0
Finding ʻOhana,2021-01-29,416,6.234,"Adventure, Action, Comedy, Family",0,0,123,18.22,Ian Bryce Productions,United States of America,"English, Spanish",Jude Weng,Christina Strain,"Kea Peahu, Alex Aiono, Lindsay Watson",6.1,"11,975",69.0,PG,1 win & 2 nominations,81.0,69.0
Below Zero,2021-01-29,912,6.4,"Action, Crime, Thriller",0,0,106,15.637,"Morena Films, Amoros Producciones, Film Factory, TV3, TVE",Spain,Spanish,Lluís Quílez,"Fernando Navarro, Lluís Quílez","Javier Gutiérrez, Karra Elejalde, Luis Callejo",6.2,"21,913",,TV-MA,2 nominations,86.0,
Nomadland,2021-01-29,3031,7.2,Drama,5000000,39458207,108,29.473,"Cor Cordium Productions, Hear/Say Productions, Highwayman Films",United States of America,English,Chloé Zhao,"Chloé Zhao, Jessica Bruder","Frances McDormand, David Strathairn, Linda May",7.3,"189,601",87.0,R,Won 3 Oscars. 254 wins & 156 nominations total,93.0,87.0
Palmer,2021-01-28,1649,8.1,Drama,0,0,110,35.494,"SK Global Entertainment, Sidney Kimmel Entertainment",United States of America,English,Fisher Stevens,Cheryl Guerriero,"Justin Timberlake, Juno Temple, Alisha Wainwright",7.3,"46,780",53.0,R,3 nominations total,72.0,53.0
Wrong Turn,2021-01-26,1166,6.0,"Horror, Thriller",0,3777969,110,57.972,"Constantin Film, The H Collective, Tea Shop & Film Company, Lionsgate","Germany, United States of America, United Kingdom",English,Mike P. Nelson,Alan B. McElroy,"Charlotte Vega, Adain Bradley, Bill Sage",5.6,"38,838",46.0,R,1 nomination total,64.0,46.0
The Sadness,2021-01-22,894,6.794,"Horror, Thriller",0,0,99,43.491,Machi Xcelsior Studios,Taiwan,Mandarin,Rob Jabbaz,Rob Jabbaz,"Berant Zhu, Regina Lei, Ying-Ru Chen",6.5,"21,853",68.0,TV-MA,3 wins & 4 nominations total,89.0,68.0
Penguin Bloom,2021-01-21,313,6.9,Drama,0,0,95,11.843,"Made Up Stories, Broadtalk, Jam Tart Films, Endeavor Content, Screen Australia, Create NSW","Australia, United States of America",English,Glendyn Ivin,"Shaun Grant, Harry Cripps, Cameron Bloom","Naomi Watts, Griffin Murray-Johnston, Andrew Lincoln",6.8,"12,785",54.0,TV-14,2 wins & 12 nominations,66.0,54.0
Outside the Wire,2021-01-15,1800,6.36,"Thriller, Action, Science Fiction",0,0,116,26.025,"Inspire Entertainment, Automatik Entertainment, Leeding Media, 42",United States of America,English,Mikael Håfström,"Rob Yescombe, Rowan Athale","Anthony Mackie, Damson Idris, Enzo Cilenti",5.4,"46,325",45.0,R,1 nomination total,37.0,45.0
The Marksman,2021-01-15,1613,6.828,"Action, Drama, Thriller",23000000,23076711,108,35.608,"Sculptor Media, Zero Gravity Management, Cutting Edge Group, Stonehouse Motion Pictures, Voltage Pictures",United States of America,"English, Spanish",Robert Lorenz,"Chris Charles, Danny Kravitz, Robert Lorenz","Katheryn Winnick, Liam Neeson, Teresa Ruiz",5.7,"44,972",44.0,PG-13,,38.0,44.0
Wish Dragon,2021-01-15,1359,7.9,"Animation, Family, Comedy, Fantasy",0,25860000,99,37.646,"Sony Pictures Animation, Tencent Pictures, Base FX, Beijing Sparkle Roll Media Corporation, Flagship Entertainment Group, Columbia Pictures","China, United States of America","Mandarin, English",Chris Appelhans,"Chris Appelhans, Xiaocao Liu","Jimmy Wong, John Cho, Constance Wu",7.2,"35,402",59.0,PG,4 nominations total,71.0,59.0
The Dig,2021-01-14,1201,6.866,"Drama, History",0,0,112,13.006,"Clerkenwell Films, Magnolia Mae Films",United Kingdom,English,Simon Stone,"Moira Buffini, John Preston","Carey Mulligan, Ralph Fiennes, Lily James",7.1,"84,823",73.0,PG-13,Nominated for 5 BAFTA 3 wins & 11 nominations total,87.0,73.0
The White Tiger,2021-01-13,893,6.964,Drama,0,0,125,15.427,"Lava Media, Noruz Films, ARRAY Filmworks","India, Singapore, United States of America","English, Hindi",Ramin Bahrani,"Ramin Bahrani, Aravind Adiga","Adarsh Gourav, Rajkummar Rao, Priyanka Chopra Jonas",7.1,"66,856",76.0,R,Nominated for 1 Oscar. 7 wins & 17 nominations total,92.0,76.0
Batman: Soul of the Dragon,2021-01-12,345,6.726,"Animation, Action, Adventure, Crime, Fantasy",0,0,83,9.622,"Warner Bros. Animation, DC Entertainment",United States of America,English,Sam Liu,"Jeremy Adams, Bob Kane, Bill Finger","David Giuntoli, Mark Dacascos, Kelly Hu",6.1,"7,677",,R,,93.0,
The Dry,2021-01-01,699,6.82,"Crime, Thriller, Mystery",0,15576286,117,23.844,"Made Up Stories, Pacific Standard, Screen Australia, Film Victoria, Arenamedia, Pick Up Truck Pictures","Australia, United Kingdom, United States of America",English,Robert Connolly,"Harry Cripps, Robert Connolly, Jane Harper","Eric Bana, Genevieve O'Reilly, Keir O'Donnell",6.8,"36,080",69.0,R,6 wins & 22 nominations total,,69.0
Shadow in the Cloud,2020-12-31,986,5.827,"Horror, Action, War",0,1054290,83,19.854,"Four Knights Film, Rhea Films, Automatik Entertainment, Endeavor Content, Hercules Film Fund, New Zealand Film Commission, Fulcrum Media Finance","Luxembourg, New Zealand, United States of America, Australia",English,Roseanne Liang,"Max Landis, Roseanne Liang","Chloë Grace Moretz, Nick Robinson, Beulah Koale",5.0,"32,463",66.0,R,2 wins total,77.0,66.0
